{
  "$schema": "https://json-schema.org/draft/2020-12/schema",
  "$id": "https://gomercin.github.io/mosaic/schemas/public-mosaic.v1.schema.json",
  "title": "Mosaic approved public dataset v1",
  "type": "object",
  "properties": {
    "schemaVersion": {
      "const": "1.0"
    },
    "datasetKind": {
      "enum": [
        "synthetic",
        "curated"
      ]
    },
    "publication": {
      "type": "object",
      "properties": {
        "status": {
          "const": "approved"
        },
        "reviewer": {
          "type": "string",
          "minLength": 1
        },
        "revision": {
          "type": "string",
          "minLength": 1
        }
      },
      "required": [
        "status",
        "reviewer",
        "revision"
      ],
      "additionalProperties": false
    },
    "profile": {
      "type": "object",
      "properties": {
        "name": {
          "type": "string",
          "minLength": 1
        },
        "title": {
          "type": "string",
          "minLength": 1
        },
        "tagline": {
          "type": "string",
          "minLength": 1
        },
        "summary": {
          "type": "string",
          "minLength": 1
        },
        "location": {
          "type": "string",
          "minLength": 1
        }
      },
      "required": [
        "name",
        "title",
        "tagline",
        "summary"
      ],
      "additionalProperties": false
    },
    "capabilities": {
      "type": "array",
      "items": {
        "type": "object",
        "properties": {
          "id": {
            "type": "string",
            "minLength": 1,
            "pattern": "^[a-zA-Z0-9][a-zA-Z0-9:_-]*$"
          },
          "label": {
            "type": "string",
            "minLength": 1
          },
          "category": {
            "type": "string",
            "minLength": 1
          },
          "description": {
            "type": "string",
            "minLength": 1
          }
        },
        "required": [
          "id",
          "label",
          "category",
          "description"
        ],
        "additionalProperties": false
      },
      "minItems": 1
    },
    "principles": {
      "type": "array",
      "items": {
        "type": "object",
        "properties": {
          "id": {
            "type": "string",
            "minLength": 1,
            "pattern": "^[a-zA-Z0-9][a-zA-Z0-9:_-]*$"
          },
          "label": {
            "type": "string",
            "minLength": 1
          },
          "description": {
            "type": "string",
            "minLength": 1
          }
        },
        "required": [
          "id",
          "label",
          "description"
        ],
        "additionalProperties": false
      },
      "minItems": 0
    },
    "experiences": {
      "type": "array",
      "items": {
        "type": "object",
        "properties": {
          "id": {
            "type": "string",
            "minLength": 1,
            "pattern": "^[a-zA-Z0-9][a-zA-Z0-9:_-]*$"
          },
          "title": {
            "type": "string",
            "minLength": 1
          },
          "type": {
            "type": "string",
            "minLength": 1
          },
          "company": {
            "type": "string",
            "minLength": 1
          },
          "period": {
            "type": "object",
            "properties": {
              "start": {
                "type": "string",
                "minLength": 1
              },
              "end": {
                "type": "string",
                "minLength": 1
              },
              "label": {
                "type": "string",
                "minLength": 1
              }
            },
            "required": [
              "start",
              "label"
            ],
            "additionalProperties": false
          },
          "summary": {
            "type": "string",
            "minLength": 1
          },
          "publicNarrative": {
            "type": "string",
            "minLength": 1
          },
          "challenge": {
            "type": "string",
            "minLength": 1
          },
          "approach": {
            "type": "string",
            "minLength": 1
          },
          "impact": {
            "type": "string",
            "minLength": 1
          },
          "strengthenedCapabilities": {
            "type": "array",
            "items": {
              "type": "string",
              "minLength": 1
            },
            "uniqueItems": true
          },
          "revealedPatterns": {
            "type": "array",
            "items": {
              "type": "string",
              "minLength": 1
            },
            "uniqueItems": true
          },
          "tools": {
            "type": "array",
            "items": {
              "type": "string",
              "minLength": 1
            },
            "uniqueItems": true
          },
          "principles": {
            "type": "array",
            "items": {
              "type": "string",
              "minLength": 1
            },
            "uniqueItems": true
          },
          "tone": {
            "type": "array",
            "items": {
              "type": "string",
              "minLength": 1
            },
            "uniqueItems": true
          }
        },
        "required": [
          "id",
          "title",
          "type",
          "period",
          "summary",
          "publicNarrative",
          "challenge",
          "approach",
          "impact",
          "strengthenedCapabilities",
          "revealedPatterns",
          "tools",
          "principles"
        ],
        "additionalProperties": false
      },
      "minItems": 1
    },
    "evidenceEpisodes": {
      "type": "array",
      "items": {
        "type": "object",
        "properties": {
          "id": {
            "type": "string",
            "minLength": 1,
            "pattern": "^[a-zA-Z0-9][a-zA-Z0-9:_-]*$"
          },
          "experienceId": {
            "type": "string",
            "minLength": 1,
            "pattern": "^[a-zA-Z0-9][a-zA-Z0-9:_-]*$"
          },
          "summary": {
            "type": "string",
            "minLength": 1
          },
          "myContribution": {
            "type": "string",
            "minLength": 1
          },
          "teamContribution": {
            "type": "string",
            "minLength": 1
          },
          "aiContribution": {
            "type": "string",
            "minLength": 1
          },
          "result": {
            "type": "string",
            "minLength": 1
          },
          "limitation": {
            "type": "string",
            "minLength": 1
          },
          "outcomeStatus": {
            "enum": [
              "delivered",
              "stopped",
              "idea"
            ]
          }
        },
        "required": [
          "id",
          "experienceId",
          "summary",
          "myContribution",
          "teamContribution",
          "aiContribution",
          "result",
          "limitation",
          "outcomeStatus"
        ],
        "additionalProperties": false
      },
      "minItems": 1
    },
    "evidenceLinks": {
      "type": "array",
      "items": {
        "type": "object",
        "properties": {
          "id": {
            "type": "string",
            "minLength": 1,
            "pattern": "^[a-zA-Z0-9][a-zA-Z0-9:_-]*$"
          },
          "capabilityId": {
            "type": "string",
            "minLength": 1,
            "pattern": "^[a-zA-Z0-9][a-zA-Z0-9:_-]*$"
          },
          "experienceId": {
            "type": "string",
            "minLength": 1,
            "pattern": "^[a-zA-Z0-9][a-zA-Z0-9:_-]*$"
          },
          "episodeId": {
            "type": "string",
            "minLength": 1,
            "pattern": "^[a-zA-Z0-9][a-zA-Z0-9:_-]*$"
          },
          "explanation": {
            "type": "string",
            "minLength": 1
          },
          "signalType": {
            "enum": [
              "strengthened",
              "demonstrated",
              "candidate"
            ]
          },
          "confidence": {
            "enum": [
              "high",
              "medium",
              "low"
            ]
          },
          "confirmedByUser": {
            "type": "boolean"
          }
        },
        "required": [
          "id",
          "capabilityId",
          "experienceId",
          "episodeId",
          "explanation",
          "signalType",
          "confidence",
          "confirmedByUser"
        ],
        "additionalProperties": false
      },
      "minItems": 1
    }
  },
  "required": [
    "schemaVersion",
    "datasetKind",
    "publication",
    "profile",
    "capabilities",
    "principles",
    "experiences",
    "evidenceEpisodes",
    "evidenceLinks"
  ],
  "additionalProperties": false
}
